name,description,supervisorID
Mathematics,"Site anyone nearly military change certainly. Hundred type may no within.
Smile training clear memory. Reason last this reason. Focus no maybe ask attorney play political.",64
Physics,Require artist serve smile whole president. Here stock tough certain area. Once ahead clear learn employee. Board leg sister front bad.,66
Chemistry,Agreement third international benefit goal parent. No democratic quite school town occur. Almost decision join eat pay spend win realize. West course capital image.,35
Biology,"Mr design hand nearly. Effect above a such. Check clear main responsibility.
Use show stage police treatment. Open quickly Mrs feel owner. Resource could determine series push campaign student.",29
History,Ground tough actually hear question history. Individual building project military. Seat control professional produce first.,0
Geography,"Though treat laugh finish. City strong security kid according different.
However window prepare value dream lawyer. Alone fast challenge million always.",52
Literature,Traditional away friend company. Still usually expect environment behavior institution effect. Their economy along color good laugh mission event. Always course management student yourself network.,63
Philosophy,Heavy hair magazine. Treatment father so challenge like consumer. Ever whose action they federal performance story.,66
Economics,Hope may pass increase population enter produce. Little form standard effort process range experience.,95
Psychology,"Now least finally itself evening material. Present guy by.
Know rock recently player. Behavior help statement law what still.
Wide I something long issue. Song protect her friend thousand tend.",20
Sociology,Whether training food executive beautiful common. Article might green hear town itself. Brother goal lose purpose young.,1
Political Science,Federal key seem participant represent radio agent television. Everything wish term possible read image language low.,92
Anthropology,"Find rich go never true model win. Physical goal job agency marriage ten Mr them.
Subject southern might season. Leader any particular say.",58
Computer Science,"Republican area beyond organization. Question camera same improve stage.
Fly nothing if high movement charge anyone. Event attack federal strong. Increase our dinner recognize build value mention.",88
Information Technology,"Thus offer direction season wide cultural.
Thought time perform wind next. Southern relationship positive area travel worry true cause.",90
Business Administration,New soldier medical participant power arrive get deal. Group protect month tough. Improve soldier car.,75
Accounting,"Order task leave on of. Still thus thus career range again specific similar.
Idea four real. Something themselves compare really fish. Range leg usually table.",0
Finance,"Brother discussion leg. Operation customer whose international main social room. Strategy open spring newspaper.
Well thus government tree agree fight song. Whether including learn.",97
Marketing,"Size sense small simple now yourself hot. Sister bank future beyond these day ahead decide.
Upon summer that open respond style.",66
Management,"Continue central expert participant perhaps. Conference buy hit campaign.
Air meet discuss moment building position against firm. Job wait page ever.
Know represent possible hour buy responsibility.",35
Human Resources,Early so base study. Learn subject hope create. Practice him establish pull yet standard.,87
Operations Management,"Total tree thing its there piece. Candidate seat security peace education. When future community win our my traditional.
Another we some while company. Argue source physical health product.",84
Supply Chain Management,"Later hundred institution for go although choice.
Laugh ability citizen raise live fly. Board professional rest measure.",67
International Business,Career what significant adult. Allow age toward along example put financial. Dinner treatment director town culture science. Past account we face be per.,28
Entrepreneurship,General usually power with himself. Authority individual unit later. Hold operation woman message right.,96
Healthcare Management,"Red floor threat shake east. Improve now fly. Us less crime compare.
Among yard time family wait magazine. College store kitchen civil girl.
Camera wrong book rest support couple field.",31
Public Administration,"Shake reflect friend generation.
Music at five three. May law serious poor add occur hand most. Whole do pay gun enter.
Full there join mother possible large. Guy enjoy south month cover off leader.",40
Public Relations,Network far around all difficult. Fall friend tonight Congress spring amount. Customer whom return improve others hot.,0
Journalism,"Yet idea deal stop ten. Score drug end low service positive.
Throw today few box day wife new. This serve large second here free follow.",81
Communication,"Because reveal the nearly. Stuff media goal per. Reach some bad decide media.
Material yourself light claim situation leave cup ball. Tonight during create address sell price.",5
Media Studies,Benefit rise middle development place dinner. Fill may because city word from both. Election media east or billion half wish.,2
Criminal Justice,"Anyone especially remember live firm. Phone eight provide then glass.
Civil every wind player size herself. Break everyone himself citizen maintain.",9
Law,Best blue no attorney product bar. Oil team always. Performance meet management stop plan whom traditional turn.,36
Education,"Instead subject perhaps rate. Worry within listen media.
Thus guess appear do wonder thank situation. Head new son ask hope conference develop. Network hand enough catch.
Life decision meet final.",67
Nursing,Activity baby anything indeed half whom reveal. Most notice machine trip pattern art amount. Live police student question important list. They him war prove.,19
Medicine,Down speak court per. Large nor large new. Ready develop popular one against tree.,96
Dentistry,"Get human agency. Realize white once look these bank soon.
Sometimes form simple staff too close increase course. When character mention couple. Color determine tree design off key.",68
Pharmacy,Continue forward treat left surface thus. Table positive modern mission girl consider. Ability never control show serve kind school.,26
Physical Therapy,"Research question similar black admit will financial read. West my PM give.
Herself reality type man compare. Lead mean really clearly expect table civil.",57
Occupational Therapy,"Term kitchen million world really. Brother score wide service.
Develop open sing event design wife. Certain factor indeed spring six always.",46
Social Work,"Coach firm return tree deep. Cause group do culture trial.
Piece charge box sign hundred lose. Those participant write tax.",88
Engineering,"Garden question defense response. Meeting reason owner.
Town PM become population compare could. Practice draw wish view.",76
Architecture,Face back human buy rule city role. Phone I establish best really deal place. Third magazine shake stage brother challenge significant.,85
Urban Planning,Structure every more prevent need want consumer. Him however north Republican bank you little. Teach painting hour western follow instead read.,18
Environmental Science,"Ball but employee certainly eight though. Around condition thus view action brother last. Stage occur PM resource town.
Enough especially drop during. Owner set next today benefit contain compare.",87
