instructorID,meetingLink,recordingLink,description,translatorID,languageID
389,http://www.learning.com/1mvvcx9tkz9y,https://flores-young.com/,"Finish close ok service set key chair. Third different yourself heavy senior.
Cultural board hold social behavior parent off everyone.",285,65
649,http://www.learning.com/mda48gebb17x,http://www.lyons-valencia.info/,"Very seat ready site. Office raise draw by sign tax. Young too between page.
Everyone great hit along remain. Scientist only arrive direction culture answer by.",900,13
590,http://www.learning.com/qnn9ubmqu919,http://smith-west.net/,"Drive leader image sign help human own. Major trip law himself.
Indeed program form now daughter argue suffer. Draw person would fly set. Return win behavior them rest sing husband PM.",439,16
251,http://www.learning.com/6xk5iwqm2ikj,http://www.deleon-johnson.org/,Factor line especially huge organization up. See employee mean sometimes determine standard serve.,318,57
747,http://www.learning.com/dh7jkgwqs5zz,http://fuller.com/,"Police analysis former so radio. Walk forget maintain sport. Test close in could.
Floor person value participant particularly positive east. Already hit where leave.",345,45
581,http://www.learning.com/5w96f4ymu2cz,http://martinez-watkins.biz/,"Instead throughout trial. Deal southern term.
Young father somebody heavy town. Lose evidence hand century energy. These describe who.",564,48
392,http://www.learning.com/ge11pztnnslu,https://greene-davenport.info/,"Close image management environmental. Sound mind reduce take third. System situation toward interesting assume seat.
Tough current exist then account degree. Provide life hot control many.",597,42
612,http://www.learning.com/i4ljlntnsf2j,https://chambers-erickson.com/,"Live somebody large phone. Fine could two though onto sense.
Coach customer business lot central. White with ago day figure federal get. Method allow drive girl act west imagine.",228,11
831,http://www.learning.com/jeradc12yqoj,https://bruce.net/,"Herself window time could provide. Maintain success feel. Believe fine figure here tough.
Offer sign relationship support everybody. Research particularly threat allow.",511,34
620,http://www.learning.com/mfp8fyk6dwk6,https://gordon-murphy.com/,"Contain adult very anyone order. Control her pull. Run our final final or method lose.
Tell serve reveal professional. Thus analysis old benefit health I.",749,2
127,http://www.learning.com/fejlqrixuqo2,https://taylor.net/,"Hotel security rule book form. Recent team letter.
Degree shake almost issue need mean. Who type believe decade. Every put soon coach.",152,44
796,http://www.learning.com/03seosrmlf34,http://www.jenkins.com/,"Money debate last head new knowledge. Leave term total go within.
Cup produce food think court agent allow. Beat window exactly really than public. Beautiful baby thank.",372,40
109,http://www.learning.com/7gjrkc99wc22,https://phillips-white.com/,"Certain wear conference next baby. Bag something attorney last big possible seven.
Into beat enough tax drug laugh. Second car million yeah.",597,42
124,http://www.learning.com/zkfybak21xkb,http://www.wilson.com/,Now clearly other however. Material feeling performance maintain check class raise. Either lose drop talk table none him. Can animal read last final.,110,60
447,http://www.learning.com/ifl8mx30v7dr,http://www.sanchez.com/,Only view million receive pass tough window. Foot up now process. Consumer value human color.,308,59
908,http://www.learning.com/3cpwfa5gk29r,https://jackson.com/,"Guy or institution tough. On how teacher moment set.
Nearly story movie popular reveal maintain coach. Necessary as particular and.
Herself be above.",372,30
356,http://www.learning.com/hw4o4s7h44c4,https://sanders.com/,Single leader senior test. Article leader and effect food trip. Century check specific whole think cost.,381,19
923,http://www.learning.com/261vgp6wjhig,http://www.phillips-ewing.info/,Response just program south. Really offer example condition much.,425,18
827,http://www.learning.com/ztusr6x99whv,http://www.lara.biz/,Usually discussion experience what. Test free money blue foot receive. Explain poor way partner example in.,548,4
119,http://www.learning.com/e11wqgn6acm0,https://shaw-miller.com/,Machine Congress truth standard throw subject. Scene church but thousand push heavy research enjoy.,558,62
721,http://www.learning.com/jz2r24ga6vob,http://nelson-merritt.net/,"Tv listen language upon development. Hard free power father space special song. Common air the think.
Take your husband former keep gas little. Street which sure old.",381,19
142,http://www.learning.com/bv16693nzod2,http://www.colon.com/,"Cold no performance marriage bring.
Cut pass fish change win. Feeling anyone take.
Bill Mrs camera develop. Including most story position statement city staff laugh.",308,59
197,http://www.learning.com/vjee094dh6o4,https://www.cannon.com/,War green wife home down impact line. Become single tell develop develop seat attention.,818,32
360,http://www.learning.com/9felu7pgpqfa,https://wheeler-white.com/,"Last degree enough recent. Fact type exactly major.
Figure material beat gas remember note job. Hospital fish me why oil would. Responsibility fear dog child could turn.
If near expect war building.",548,58
502,http://www.learning.com/cbkkbwa0kf7b,https://smith.net/,"Wait agency owner speech. Task night standard large safe add like.
Question participant class others black. Feeling of international list.",372,30
799,http://www.learning.com/0z8if0qk0n72,http://www.phillips.com/,"Class type despite never.
Degree performance certain sea sure happy. Right weight time. Upon after usually that down career here.",54,27
699,http://www.learning.com/8zorxbobqb6l,https://hughes.org/,"Inside own kind suddenly social. Give include house less range maybe speak production.
Close force debate network. Computer oil explain child commercial.",372,40
963,http://www.learning.com/amm8si0kxpka,https://mclaughlin.com/,"Pass surface local sister.
Agency lot peace. Toward success girl already chance star. Drug when remember guess.
Become coach successful free radio at natural. Big civil indicate very.",680,36
478,http://www.learning.com/zmw30tfhw6rn,https://www.lawrence-fields.net/,Hundred month physical shoulder maybe mouth. Successful raise say sell ok. Or kitchen hospital many meet.,755,49
337,http://www.learning.com/dek2w8vlebtg,http://sharp-kirk.com/,"Now boy during history large. Possible generation mean sing. Manager cause dark class.
Enter because meeting sense property detail sometimes. Natural reveal tree indeed.",782,12
257,http://www.learning.com/i8xe6xnxs2vq,http://www.myers-fernandez.com/,Ball budget add Mr window start month. Order over maybe increase. Mrs TV firm near.,527,35
283,http://www.learning.com/v4pa8jqyn1ib,http://www.mcgee.com/,"Even family fact business morning travel.
Standard thousand old foreign. Agreement become newspaper gun tax determine. Apply it seek small people long.",871,28
539,http://www.learning.com/7c99y4dxl36o,http://graham-yoder.com/,Standard citizen end position I yet. Lead oil rather strategy. Bill late capital system fly bar prove.,318,57
634,http://www.learning.com/79w5meg0ha6x,http://www.zimmerman-ortega.com/,"Hundred us lose task. Future tough reach receive everybody model form. Cover catch apply when run serve by. Expert his pick door trial eat green.
Social it four despite wait check.",371,31
631,http://www.learning.com/tsz9xlb5erkt,https://potter.info/,"Left newspaper range in item. Leg stay win sea house culture. Nearly discuss stay friend.
Pretty real medical move purpose article. Wear us hundred.",442,23
694,http://www.learning.com/a8uduye4gp2x,http://anderson.com/,Light successful discuss author perform. Stand professional vote face sport country. Gun writer or not single black main.,430,68
90,http://www.learning.com/v82icivv5782,https://www.winters-sexton.com/,"Side away expect red language usually continue. Suggest recent kitchen American.
Owner doctor politics back send. Mrs give others trade. Meet take idea national voice.",454,14
136,http://www.learning.com/genpxpgptkyp,http://www.mullins.com/,National fine college three contain everybody must. Think international dream city cup. Store than order.,152,44
379,http://www.learning.com/81eodkn5t730,https://www.gould-howard.com/,"Full begin clearly able. Improve operation state right care because. South office include treatment adult they work.
Large building behind employee. Agency like difficult myself hour blood.",511,53
500,http://www.learning.com/bbb9rxgpf2aq,http://www.parker.com/,"Ever paper for exist.
Market issue plant ago energy history reflect. Small hold certain note service plan expect. Home white both bring spring consumer.",755,49
501,http://www.learning.com/fmld0i59egao,http://rodriguez-house.com/,Congress other like case himself. Person ability data president trial prepare. Expert type group prepare employee fine.,755,49
476,http://www.learning.com/pgba7vbqr3ke,http://www.cummings.com/,Challenge situation identify as successful. But likely wind white. Director mother eye party.,597,52
895,http://www.learning.com/55qy0zzanoii,http://carpenter.com/,Trip manage number senior born contain. View little him scientist after spend. Parent quality less inside something town character.,318,57
591,http://www.learning.com/op5ncl37c8b6,https://www.brown.biz/,"Similar area everybody good cover decide. Claim memory trade window.
Yard thousand century past item hair. Attack learn purpose message number both.",454,66
453,http://www.learning.com/vjwoe2yqd5tb,https://davila-perry.biz/,Actually art glass war performance. Miss goal food born service always. Action remain each appear.,425,18
868,http://www.learning.com/mozg5aqcwwwi,https://terry.com/,"Data my authority police open. Raise likely least contain move. Affect onto three daughter him.
Only information never exist floor. Several office brother clearly.",454,14
479,http://www.learning.com/q6xq2whngk5b,https://gonzalez-weiss.com/,West especially opportunity season size ball southern perhaps. Tell student avoid while whose.,228,11
300,http://www.learning.com/3ofnabwnemqs,https://www.washington.biz/,Mother white trouble now live each. Someone bar strong thousand either. Million into but civil speak. Guess own church subject second especially.,900,13
163,http://www.learning.com/hpysj5j552wi,https://hall.com/,"Finally should kitchen item hit. Long social author someone table challenge.
Cell event mean order among example. Seat free follow something.",416,61
446,http://www.learning.com/hvc9qfz1bc7l,https://anderson.com/,Peace PM radio. Increase hold first under shake similar enter. Move morning computer teacher every point accept.,228,11
933,http://www.learning.com/zgik5w3sgui4,http://boyd-chavez.biz/,"Could month meeting newspaper. Explain rise would magazine station yet.
Church serious movie reality focus community size yourself. People mother act partner.",430,68
595,http://www.learning.com/e3gdjgz2v20n,https://www.brandt-anderson.info/,Resource become six month let affect teach particularly. Each quickly live bad large enter.,511,53
622,http://www.learning.com/pwii0pf94fls,https://www.elliott-walker.info/,"Apply ok computer operation ago cover. Along new hour major those skin short. Position drive exactly.
There agency trouble collection trial image approach. Report specific around who government.",749,2
530,http://www.learning.com/mrxlfdai2vby,https://www.west-waters.com/,"Hair million single wonder. New point hit whom wind key imagine. While with quickly concern determine.
Nothing Democrat hot subject personal really. Two good his situation company.",755,49
820,http://www.learning.com/au3lodefcifl,http://allen-miller.net/,"North Republican poor wall hair sign enough system. Return alone every. Three into nice argue inside worry.
News inside impact enough. Source organization why.",228,11
558,http://www.learning.com/uywu1cm73uoc,https://www.gibson-underwood.net/,"Sure out where level receive suggest child. Arm may five song live require. Possible now often send.
Often wait current information. Owner door along message same.",867,25
600,http://www.learning.com/sv5co76o86gb,https://lee-fuller.net/,Against film left hand color chance message. Full tax low head strategy.,152,44
677,http://www.learning.com/8o58bw7bij6g,http://www.coleman.info/,"Here forget along economic statement whole. Long must simply own many. Degree professional seem politics.
Ok guess method interest approach. Move long I apply. Type between between.",110,64
419,http://www.learning.com/bk86xsnun4le,http://pacheco-macias.net/,"Apply human bank material mention against son thus. Maybe once possible. Impact team likely wait.
Evening whose act allow effort senior company. Level popular husband charge describe realize.",511,34
767,http://www.learning.com/9tewkift0f26,https://butler.info/,"Brother simply use every specific. Poor almost choice land.
Health let computer friend deep. Film nearly close yeah both process movement his. Seven economy wife pick manager partner term food.",511,34
988,http://www.learning.com/9zkzz46tah6f,http://madden.org/,"Let protect area. Movie general technology could. Very people agent past fire.
Bill movement key once bring goal. Happen simply read none all memory. Size sound down senior beyond.",727,17
632,http://www.learning.com/6wshismhq0b9,http://www.boyd.com/,Bank necessary style effort best deal worry. Forward really share husband amount industry agreement.,548,58
878,http://www.learning.com/hi8c5u0duhsc,http://benjamin-burton.com/,"Like break and action book finish. His ahead will religious too inside song.
Simple light five center cultural around. Law soon recognize increase together.
Street tell red bar note.",867,25
260,http://www.learning.com/89dye5vovcj0,https://torres.biz/,"Long question third many level. Kid campaign our car make order down. Just summer concern leave.
Seek else training hour. Lay perhaps natural.",749,29
202,http://www.learning.com/4t1up6v8g8do,https://www.english.biz/,"Type camera financial standard one maintain lay.
Themselves he throughout. High learn entire if nation up toward. Answer check level.",285,54
358,http://www.learning.com/wbf3rz6zfqxq,https://jones.com/,"Either agreement team energy drop trouble. Wonder population music how north. Full why oil month.
Body side idea finally rich. Deal its out rather sound system show. Again foreign hot all.",818,41
872,http://www.learning.com/t1sitkqqlor4,http://robinson.com/,No office ball five environment enough. Nation natural side Democrat significant what. Begin toward possible organization.,189,37
69,http://www.learning.com/giecn15rhh59,https://schmidt-young.info/,"Career oil parent body focus represent property. Bill instead line employee.
Usually join door change. Single common debate but. Smile not soon clearly.",110,60
568,http://www.learning.com/sz753k46xxu4,https://www.harrison.com/,"Their blood soldier both reduce story.
Hundred president investment bar general. Too both son miss without. Amount fund but together eight.",454,14
439,http://www.learning.com/wmqigaxgzppt,https://www.george.com/,"Too lead anything own. Series for big grow relationship decision society.
What carry defense left president night draw. Arrive speak market smile.
Teach part six development.",416,61
425,http://www.learning.com/wk2jv4flmicj,https://www.robbins.net/,Should company here should. Attorney issue party final traditional television amount. Drop term season between.,416,61
926,http://www.learning.com/xq9nuqugjh0r,http://www.warner-duncan.com/,Design experience able letter. Course election audience establish few discussion. Teacher but much religious as. Baby key as participant.,918,8
874,http://www.learning.com/y100zp4wj8ym,http://wallace-henry.com/,Admit safe investment mean indeed always fine smile. Share full gun glass anyone daughter him. Section second ahead international very meet increase.,152,44
987,http://www.learning.com/fiw6rd7jyph8,https://www.whitaker.info/,"Among resource guess just smile occur. Produce marriage we collection same allow fly.
Once staff the.",189,1
723,http://www.learning.com/jaf0mj2x1z2a,http://www.brown-williams.com/,Return office arrive off better base off. Gun along sit pattern play stock range. Level cause team common. Mission water world others whole.,782,50
803,http://www.learning.com/ne5zxepvsfgk,http://reed.com/,"Art truth whole feel make become lawyer memory. Something cup same film tell owner.
Past local father black forward. Security lay consumer particularly.",416,43
563,http://www.learning.com/ju88rr83zmij,https://smith.biz/,Effect force serious cell stay sport. Official final food network somebody situation employee. Lay letter whether physical grow move staff do.,189,1
589,http://www.learning.com/9nlkayb6dndy,https://www.mcclain.com/,"Bar cause maybe blue financial themselves.
Relate gun mission though study some. Who truth thus special community color.",454,14
452,http://www.learning.com/ywmljkhrkwrv,https://www.mooney-santiago.info/,"Check care both Republican wide both. Wait start any study service huge spring.
Live agree executive front. Congress station establish small.",782,50
923,http://www.learning.com/e96etbrypugl,https://www.daniels.com/,"Seven degree score despite. Security follow form organization project without.
State strategy second head despite. Clearly similar far entire use structure training.",381,6
989,http://www.learning.com/2f0zvry4vb5e,https://smith-ortiz.com/,Month lay same prevent six. Nor brother already senior body manage economic.,110,64
767,http://www.learning.com/xqvogqrrekau,https://www.murillo.com/,Lead bag operation hear present like. Gun should police discover tax game coach. Team professor trouble wife throw travel choice phone. Minute follow child production moment bar he.,454,66
465,http://www.learning.com/261d0iim09b3,http://www.deleon.org/,"Look affect everybody second.
Amount example will also yes southern candidate. Because near civil.",597,52
636,http://www.learning.com/55r5t3tnkxld,https://www.walker.com/,"Agency under arrive sea why note. Process wide only past range above watch.
As firm guy get gas tough around cover. Bring area main even stop phone exist man. Himself seem in.",918,22
880,http://www.learning.com/10yv0js52z20,https://www.wiley-rogers.com/,"Hundred once without across television study similar prove. Set difference stand send notice since throw.
Population save behavior clearly one room. Skill stop set where international.",454,66
77,http://www.learning.com/8dhubt0jkxde,https://www.french.net/,Maybe specific president treat throw likely firm inside. Relationship national perhaps style light low. Region necessary may behavior reduce south civil.,189,46
645,http://www.learning.com/s1muipzq3hmu,https://barajas-johnson.net/,Expect will bring line development research possible. Character compare stock ability change take side. Nature news tough use job quite.,918,8
964,http://www.learning.com/39nnmbxj9lg2,https://flynn-liu.info/,"Election sing they few country. Throw deal television out mouth similar leave.
Child media example discuss word painting.",597,33
729,http://www.learning.com/sglj5uop6kgh,http://www.acosta.com/,"Play sort success physical of matter. Behavior tend staff tree job. Event enjoy final sound five piece cost.
Movie prevent back. Everybody material event senior other bill.",110,60
275,http://www.learning.com/kag1vea6h99e,https://www.montoya.com/,Also hard home accept traditional chance let. Challenge majority also phone fall ok assume. Fish keep face.,416,43
995,http://www.learning.com/vippbp2vm50s,http://reese.com/,"Administration who person peace write speech. Major evening system threat.
Toward as summer because spend end. Affect discussion policy music economic ok.",548,4
782,http://www.learning.com/z3ul0101gqqa,https://www.moore.biz/,"Skin among follow control how. Car democratic fight free can.
Edge some my start head argue. Order environment gun eat. Memory around call raise. Person present machine first.",867,25
206,http://www.learning.com/qcqym7wjthm9,https://www.herring.com/,Total myself party material. Development apply clear five control. Number upon person response determine growth rate.,782,12
164,http://www.learning.com/8o1jmr5l9usj,http://green.com/,"Newspaper political trouble plan the team wide. Produce reason medical behavior job stay.
Boy yourself spring about. Training put dog hospital site spring study worker.",285,65
901,http://www.learning.com/v6q8ot2pranq,https://johnson.com/,"Young so through training. Positive book point moment black red. East customer real suddenly sense focus. Concern fine technology happy.
Certainly manager fine of party. Hit yet doctor peace against.",961,20
7,http://www.learning.com/riqykqae2yth,http://pitts-zhang.com/,Number while report build would agree able girl. Free along last catch prevent street. Part enter partner bar boy piece star.,110,64
416,http://www.learning.com/r07z1433bln3,http://butler-brooks.biz/,"News population realize direction. When of service rich keep pay. Building people use choose main.
Action young we front. Involve edge eight rule shoulder interest.",548,58
666,http://www.learning.com/zwxosg4jywif,http://www.cruz.com/,"Finish few personal popular unit ready drop. Space keep national wide position.
Several close fall. Really wait until.",110,64
652,http://www.learning.com/6w7etydbg225,https://www.sanders-alvarado.biz/,"Congress them continue some mean. Support soon peace south everybody large fine. Around time determine together hotel audience allow.
Lot few civil floor foot. Anything call improve treat visit.",381,19
365,http://www.learning.com/jqn5kvi4rzti,http://www.smith.com/,"Today song night another nation. Husband support husband site trial star. Professor pattern court picture decide.
Choice involve provide improve bar through. On in concern.",54,21
335,http://www.learning.com/lnnqlmgrhi7w,http://reynolds.com/,"Next order drive produce pass current expert. Building note nature value.
Worker hotel front player forget in. Seat main ago dog record tonight. Community look prevent garden beat.",558,62
832,http://www.learning.com/5rrn89ywyt6b,http://kelly.com/,"Dream whether movie drive wish old. Leg modern person value born.
Human deep necessary hand store administration. Ability sit never perform art goal. Contain act him.",597,52
912,http://www.learning.com/moyfql57kpey,https://williams.com/,"Boy politics city usually Mr.
Its worry respond ok. Lay south sign concern. Short artist wrong good wonder away trouble.",371,31
475,http://www.learning.com/5kx9w060t7q0,http://www.berry.com/,Fly their key fight common lot treat. Authority perhaps seem ask shoulder. Order store dinner grow option. Rather information very end deal out tend.,782,50
303,http://www.learning.com/xo7hwnw0bmev,http://www.park-lewis.com/,Degree media foot executive or hundred discuss. Fine approach series. You thought scientist best news some its.,597,42
294,http://www.learning.com/hy0k3neaqqxz,https://www.blevins-jordan.biz/,"Trial stay meet decide. Thank even thus offer deep change former include.
Safe son evening born general religious laugh for. Mouth theory present apply occur middle.",416,61
213,http://www.learning.com/s7dtsvmfqk1s,http://arellano.info/,"Expert easy effect next. Hour sea firm left right sister plan. Close eight worry these success.
Role close close. Put work economic simply. Church scientist author not whether.",597,52
443,http://www.learning.com/rg5ge0nmr7nw,http://www.gray.com/,"Late simple knowledge fire. Clearly national laugh good TV scientist can color.
Candidate history style training different. Term four majority difficult manage simply paper.",308,47
665,http://www.learning.com/ml7o3w2tx4ol,https://www.bailey-bradley.info/,"Into soldier student effort hot. Kind worker house opportunity push discover. Per figure small partner.
Speech green American no send.
Thing task boy television budget.",228,11
332,http://www.learning.com/9b06xld4tqro,http://hall-montgomery.com/,Control by least early husband night. Into our across young section. Design do just son clear.,867,25
968,http://www.learning.com/j1pgc62nbvbm,https://www.wade.com/,Lay case little agency light treat large international. Responsibility happen military activity natural fire. Civil yourself to series road will. Activity right peace recent more.,430,68
92,http://www.learning.com/upfqf1rk5ofm,https://www.morris.org/,Speech seat table dinner less degree board interesting. Add across near pressure. Fall think pass answer church get.,782,50
101,http://www.learning.com/kvq9nw6vek3l,https://www.bean.com/,"Week head bar dark. Most consumer one speech. Soon grow budget trip.
Place site training professional social kitchen value. Letter avoid huge similar order and.",189,1
181,http://www.learning.com/wp2tqf1fqlkw,http://www.rose.com/,"Dream someone firm front. High lay clearly name. Budget account land.
American word until early realize factor fill. Treatment east with. Young laugh either house reach.",597,42
372,http://www.learning.com/h4nl42k7hm9j,https://www.jones-bowen.com/,"Major home other to. Another street year protect former our cut.
Expect several better little painting high. Almost two finally.",228,11
925,http://www.learning.com/qzdoph09m5dt,http://whitney.com/,Drug both tough choice door friend deal loss. Style instead will dinner adult Mrs all. Various born risk identify.,755,49
356,http://www.learning.com/t1fvtjqxs5bo,https://www.mathews.com/,Continue ability political new traditional. Price so everybody Republican reveal own onto. During other eat worker now.,264,51
649,http://www.learning.com/az7laqa8urrn,https://www.stark.com/,Bad nation Mrs property team. Morning factor worry them. Example resource wind break truth.,511,53
