instructorID,meetingLink,recordingLink,description,translatorID,languageID
244,http://www.learning.com/wtkdni456hbf,http://www.lee.com/,To such then out issue rule. Particular majority among century claim. Support nice stay.,264,51
616,http://www.learning.com/mode9whzzfsg,https://adams.com/,"Wear method Mrs travel. Quite effect movie design before film.
Responsibility hospital small hard. Crime name again technology. Friend save we it apply blue.",900,13
194,http://www.learning.com/vltwoqwvuvuj,http://www.campos.net/,Such subject career believe. Identify represent writer conference need training her animal. Recently end beat others.,454,14
696,http://www.learning.com/btcf1ib1npgm,http://www.ochoa.com/,"Decision change enjoy church sister could without. May artist open work attack.
Security exactly special them show floor traditional top. Spring when while major where. Quite medical if reason.",967,39
545,http://www.learning.com/1ihmc35bgxun,https://powers.biz/,News since center part dark while. Group usually significant break seven.,527,35
247,http://www.learning.com/ru15o5iv6j75,http://www.wright.com/,Produce just he painting past. Wish discussion seem will institution result during. Democrat future to growth course former only simple. Onto kitchen in.,680,36
973,http://www.learning.com/mfo87hirayt5,https://abbott.com/,She ever site fill occur college. Poor institution national do strong candidate. Hot field event inside.,834,26
565,http://www.learning.com/0otqmn6enjdt,http://parsons-flores.biz/,"Here already themselves. Form success her build.
Cold blue thousand until common call blue. Claim level sport necessary building another most page. Tend mission score hospital bill.",680,36
438,http://www.learning.com/zl58pps6za0a,http://www.gilmore.com/,"Enough recently off side. Economy project fly whole. Can history as remain data hear.
Their woman building environmental manager assume sell. Truth hospital behavior reduce lay how reduce.",548,4
783,http://www.learning.com/88aqxbcwcrzm,http://berry-hughes.biz/,Community force possible size easy. Pressure when start baby. However picture about factor point just. Start matter send prove.,381,6
493,http://www.learning.com/w60dmegqi44r,http://www.rodriguez.org/,Certain pay measure total ground. Main along dinner detail. Quickly new PM clear citizen change. Arrive church cell significant child support forward how.,834,26
474,http://www.learning.com/ncoc06vm02p2,https://hernandez.com/,Instead wind market someone. Discussion become understand effect from suffer president however. Walk difference sound fall plant property. Office lot blood former country choice.,548,4
158,http://www.learning.com/u20006rtj17e,http://www.mercer-lucas.biz/,Pull information training none everything hundred evening. Trip pass watch or either. Response like show rest rock these.,425,67
704,http://www.learning.com/msj0no5d53r4,http://www.lozano.com/,"Admit reason camera theory company give change. Rather budget such development fast truth expect.
Physical fast move. Kind grow contain through population result.",834,26
452,http://www.learning.com/lc5tj4llry1z,https://peterson.com/,"Sell station minute claim. Find student bank available under blue material.
Expert rate catch serve. Training top shake it.",308,47
607,http://www.learning.com/70gkjowu94up,http://jackson.net/,"Environmental health my line. Maintain pay science agency television another. Effort color six successful.
Food idea check official. Turn team the wall think daughter forget seven.",755,49
287,http://www.learning.com/ycxra7oychta,https://medina.com/,"Black moment possible night. Become cover wear culture all with fact.
Fund amount serve back. Subject deep politics animal join detail. Run show begin radio hospital including language.",54,21
765,http://www.learning.com/l4cua03tbfqi,http://johnston.com/,"Show stage piece already nature. Interesting type nothing age feel.
Positive office travel accept us police bring. None account summer. They have together ask onto production lose.",152,44
47,http://www.learning.com/3lr7tytupjyl,https://duncan.biz/,Discover American personal lot will. Believe school really small pass push animal. Computer indeed born concern chance.,372,30
924,http://www.learning.com/vit8enw7qg1w,https://brown.net/,"Us yes but else event agree think. Expect hour pick baby. Effect best indeed discover town hear fight.
Message best board myself culture. Within year night most here practice hold.",425,18
823,http://www.learning.com/1zm7qdh49s8t,http://www.williams-nelson.com/,"Candidate throw rock response concern happen month away. North nearly model else.
Window like about true language firm right. Myself early magazine apply challenge institution here.",782,50
519,http://www.learning.com/d4do8nxlwakd,https://gutierrez-rose.com/,Yes watch western successful past cold. Environment again actually carry. Indeed budget action inside a form.,65,9
726,http://www.learning.com/aok8z5jl9jy7,http://giles.com/,Nor talk baby popular pattern case whom. Question out arm. Agree big board way media test majority drive.,54,21
753,http://www.learning.com/1wilgw0tvtcz,http://johnston.com/,Street type career yard those. Do entire policy billion project already. Tv group foreign be. Boy well debate he place him.,264,56
503,http://www.learning.com/507qr8lugdsv,https://miller.org/,Foreign source benefit education. Let center prevent different company before name. Hand trip only history use same.,442,23
112,http://www.learning.com/76anzu34kkri,http://www.hernandez-foster.com/,"Win teacher impact clearly right on happen. Whatever bar serve create. Leave at dinner democratic term more or.
Similar air data hit. Spend spring officer morning pass where.
Other dinner travel.",597,33
658,http://www.learning.com/6u7a8kf8ets6,https://peterson-green.com/,"Since as writer appear. Court gas cost end. Institution young law example product describe wind.
Foot model forward him. New box to loss. Heart doctor describe music authority nothing.",527,35
6,http://www.learning.com/m1y5lxl6c8tw,http://www.walsh.info/,Entire south talk almost thank teacher college issue. Put get factor second area and affect. Too country strategy ball information public.,834,26
116,http://www.learning.com/2r12dogxbq14,http://hart-cook.com/,"Finally light chair. Family why she politics sing.
Late third necessary pass. Happen claim series company mission. Vote ready analysis play community central seek.",597,42
240,http://www.learning.com/pgfsa4z8crq5,https://www.garcia.com/,"Man site owner. Personal dog final wish arm sell partner.
Anything cut building that character. Long my industry difficult for. Arrive themselves simply score either event democratic different.",110,60
138,http://www.learning.com/cz1p946hhgxi,http://www.miller.org/,"Treat tell run parent couple sometimes north. Fall them wrong she. Poor his pattern particularly.
Music lay week week. Across dream room adult.
Region memory event though.",189,1
433,http://www.learning.com/yoqv73kb9e2j,https://baker-macias.biz/,"Special writer where her paper spend. Cold stop teacher quickly during work.
Term summer despite two its produce ground. Federal style account try painting fight pass.",416,43
539,http://www.learning.com/l731itpr2sh9,https://jordan.com/,Article within throughout move. Deal agent also between.,308,47
530,http://www.learning.com/ejqq0a8ooyvk,https://www.rodriguez-ross.org/,"Audience walk Republican. Child difficult heavy ball it. Quality without most popular material relationship. Produce positive record water ok right game.
Decade stage perhaps same give data.",285,54
351,http://www.learning.com/9dsujjqyynff,http://bishop.com/,Officer chair economic new. Door start site citizen human turn. Imagine sense relationship safe win reality growth. Spring movie from let only feel over.,548,58
229,http://www.learning.com/bcpqvn32oml9,http://www.nelson.com/,"Even speak three fill. Which be image check name. Hot yes thousand dark clear will.
Especially south food spend result city second see. Recently high reduce this door onto.",442,23
350,http://www.learning.com/j79g2esnytar,http://www.oconnor-townsend.org/,Cup help account economy only son assume. More trade air somebody mission. So really they music wish visit country. Store meeting at political yet herself.,918,8
319,http://www.learning.com/wu5luvtrsk94,https://doyle.biz/,Town produce power none degree miss must. Memory finish effect use. Enjoy economic dinner campaign full four drop.,371,31
718,http://www.learning.com/qpsfnljhtptv,https://henry.com/,Game speech take pay edge feeling. Oil system mention despite we. Once but method green tell.,110,60
285,http://www.learning.com/vjwh9631w0m5,https://www.galloway-phillips.org/,"Understand pressure dog. Charge dinner keep. Loss on scene mind do despite answer.
Prevent level reach benefit time not only. Woman newspaper else hospital peace. Director role question sit game.",880,55
2,http://www.learning.com/5qsrccl62i5o,http://nguyen-robinson.com/,"Suggest name product create.
Bill identify industry pass some knowledge property. Network buy evening.",372,40
527,http://www.learning.com/c8t1tag11ybj,https://munoz.info/,Herself indicate wait read arm. Keep development start her that dark accept realize. Increase single nature rather future throughout.,318,57
574,http://www.learning.com/lk5n4ys0nl3t,https://pitts.info/,Conference expert finally difficult into wear experience. Join government do. Treat third store all.,481,3
17,http://www.learning.com/bpsfp7n5gibr,https://www.marquez.com/,"A case property almost until. Want particularly area. Positive almost point home day.
Court exist something. Right after with wait just daughter sign simple.",967,39
614,http://www.learning.com/fxzgtie61wm6,https://gillespie.net/,"Size notice know hard organization. Owner foot performance edge deep.
Popular describe challenge field leg say maintain picture. Thus movement couple actually yourself. Shake analysis that as go.",308,47
357,http://www.learning.com/xmulddi6qax5,http://watts.com/,"Amount miss relate effort shoulder. Group list from they animal detail more.
Third do exist better attack argue. Dream want those again hear.",264,51
607,http://www.learning.com/xm7gvw7hjph1,https://www.brock.com/,"Floor he camera theory stand hope. Local part which treatment. Institution case rock arm.
Wife likely live. Door offer from month condition remember none.",54,21
842,http://www.learning.com/u2g71q2k2zto,http://www.roth-short.org/,Right later goal plan television be. Situation treat begin moment property toward test. Stand outside measure standard art series indicate. Talk Democrat already along mother rich even.,110,5
134,http://www.learning.com/csj36fudskj7,https://wood.com/,"Newspaper foreign write simple site. Specific price argue build stop. Street trial as executive somebody.
Water ball move yourself whom rather.",511,34
262,http://www.learning.com/b8z5vulz536r,https://www.lozano-hill.net/,"War enter recent police ever. Simply last strategy have.
Site determine plan less wrong oil after number. How sure debate property eight.",880,55
256,http://www.learning.com/510inltf1ip6,https://freeman-smith.com/,First brother everything wait. Heavy character affect suddenly. Drug quickly different billion hope voice foreign. Listen letter both still.,110,64
874,http://www.learning.com/s15l8z7cwm38,http://jones.org/,Current remain hard car off raise. Fire near woman most than central sport so.,372,40
427,http://www.learning.com/qrk2n7ytlwop,https://campos.info/,"Road thank rich friend far change. Direction financial different past various begin.
Example young drop together current. Benefit thus opportunity end.",542,63
357,http://www.learning.com/z0y9ct87866i,https://long.com/,"Alone fight research important evening seat own. Speech talk test.
Fill executive force leave. Week cup national risk test face who.",372,40
450,http://www.learning.com/wu4chhs821jz,https://www.parker.com/,"Blue continue collection before all. Most music form benefit room around stop add. Sea those soon natural.
Attorney increase number south. Human school science instead you pressure.",110,64
880,http://www.learning.com/44oq3o92cf82,https://mayer.org/,"Agree even result party see guy think. Want according everything office indicate although movie.
Check form teach night. Table sell such to religious firm.",110,5
272,http://www.learning.com/m0cp95msh347,https://fischer-steele.net/,Set ready agree meeting doctor soldier would far. Land skill owner to reflect at issue. Natural own back kitchen worry probably. Own special hear imagine.,500,15
840,http://www.learning.com/meg2hj61flp7,https://gomez.net/,Speak side actually security defense individual. Network notice argue accept whether. Fund require down bar drug chance significant city.,189,46
924,http://www.learning.com/zmg1vu1ymtz1,http://www.edwards.info/,"Republican less process listen. Last black policy cost lose catch similar.
Rich standard pull decide that. Save else law.",500,15
858,http://www.learning.com/1h4448qe96m1,https://wagner.com/,"Edge drive still ok everybody area magazine. Set brother which prove break receive.
Identify stock but free. Goal specific time main.",880,55
352,http://www.learning.com/euivcnkbrg40,http://diaz.com/,"Star population dinner. Political require even somebody. Still environmental couple sound home space. Add safe hot worker point.
Create learn onto sense unit similar. Half bit responsibility.",564,48
328,http://www.learning.com/5j17bspy2q1m,http://www.welch.com/,"Probably course main environmental create. Short down every bit good. Buy him situation budget.
Alone lose yes notice. Individual step rate join question. Area plan analysis fight some full.",880,55
276,http://www.learning.com/947jaxdsbsk1,http://harmon.org/,"Join describe Mr wear that many. Trouble size president bag cost rock. Allow town we nor.
Choose fear station Republican. Decide lead realize.",558,62
700,http://www.learning.com/6k0jhlh479cp,https://nelson.org/,"Total majority them seem do. End little person course.
Air build people response. Serious remain somebody company. Court suddenly senior successful despite.",285,65
370,http://www.learning.com/7vz3xa7rh5bk,https://thompson.com/,"Significant ground instead sea guess. Meet address study both middle.
Too he yes size main. Provide billion country ground five affect.
Social drug spring card behavior.",548,58
47,http://www.learning.com/xjx81yhfj45c,https://www.meyer.com/,Arrive place service. Animal task campaign among late street international.,264,51
261,http://www.learning.com/27afaa54oi8z,https://www.schneider-smith.com/,Entire lot tax. Cut direction argue chair budget structure call represent. Beat nothing number material direction could apply. Paper with author follow provide apply country.,597,52
464,http://www.learning.com/1uq32vqowrdn,http://pham-dean.com/,"Price ready term organization. Current home us them have meet.
Nice range health current choose. Sit agree today like house eye. Event subject factor since either see anyone front.",818,32
368,http://www.learning.com/qkmtk9dnx2dk,https://glenn.net/,Cover commercial available couple language activity behavior. Structure center tell particular book interesting. Factor professional picture feel short beyond.,597,52
679,http://www.learning.com/jrseqphzq0xi,http://lee-jacobs.com/,"Response Democrat film which civil meeting sound trade. Detail approach stage.
Into indicate force pressure hundred product drive. However choose man first middle big goal might.",818,32
578,http://www.learning.com/i267i7prbvvt,https://lopez.com/,Important direction your point onto bill. Tree international seat budget quickly product. Long common admit above team line walk.,564,48
408,http://www.learning.com/dmfrvsmebuge,http://www.merritt.net/,"Radio decision provide. Necessary building good manage.
Risk government natural almost.
Often dark drive senior mind. Approach become college arm. Small economic modern into offer already common.",454,66
726,http://www.learning.com/q5mz06qt2oiv,https://www.franklin-hopkins.com/,"Really into quite memory large finally reason. Benefit civil hear.
Nice police doctor entire forward. Concern effort wait school group maybe.",425,18
386,http://www.learning.com/m2fuv6m2gm8b,http://hunter.com/,"Product class moment culture happen include. Difference think nor together debate term.
Well space model sea event traditional move. Daughter Democrat play. Particularly daughter cut.",416,43
767,http://www.learning.com/8ksmu99e5kax,https://burke.com/,"Lay personal care talk reflect along laugh. Itself this financial candidate size.
Data bed here man general walk. Million rather able culture.",439,16
848,http://www.learning.com/t629rng7eg6b,http://www.glass.com/,Sign blue my meeting tell drive behind friend. Alone them feeling want home both. Leader strong investment determine.,425,18
737,http://www.learning.com/7hh5dy0ec1lg,https://bowers-williams.com/,Onto reason product through could. Worry over likely hope become money. Maybe trouble according employee.,481,3
387,http://www.learning.com/7ghj2ov8hw8d,http://www.hall-golden.com/,"Alone hair student shoulder standard out their relationship. Wonder mission character party.
Option success responsibility simply win. I their could large. Upon throw talk official way.",818,32
520,http://www.learning.com/qsnmb9pflz6r,http://www.green.com/,"Drive prove read value respond toward much. Race me Republican himself star.
Relate strong executive skin. Improve read theory require position table rest. Year land bed bad course specific.",285,54
815,http://www.learning.com/h5ha065pyhjn,https://www.gutierrez-murray.com/,"Local more remain technology better.
Fast the alone above. Same write me water nice. Organization raise source general.
Wish employee despite shoulder likely strong. Home ever Mr while apply way guy.",548,4
879,http://www.learning.com/wkp3z2j9us07,https://hill.net/,Difference short that difficult. Other including detail right speak. Culture second down mind rock week throw size.,454,10
396,http://www.learning.com/4nmxyrz1xdt5,http://martin-owens.org/,"Although beyond send end former. Born onto often consumer.
Financial member yet like night. Across use fast factor design. There seem shake middle west major animal.",597,42
387,http://www.learning.com/r0pzs2dbdces,http://www.taylor-perez.com/,Physical professor civil lot design. Section degree skin tend instead. Enjoy guess cold teach.,454,66
436,http://www.learning.com/0k25pzzqt7bl,https://hammond.info/,Along really again region. May raise at early save north rich. With generation season lead total open leg.,127,38
250,http://www.learning.com/s3cqkxpsghjt,http://www.mosley.com/,Protect for day debate give change pick. Democrat couple before order most attorney. Success news foot decade trade of PM.,442,23
777,http://www.learning.com/exe11kcotqxd,http://marquez.com/,Again thus enjoy enjoy simply set. Far speech performance hotel bank today memory form. Test list ten imagine thus born can.,597,42
967,http://www.learning.com/gotzywea989s,http://george.net/,City represent performance century. Inside daughter high education adult. Fund present door seven prepare hospital worker.,542,63
614,http://www.learning.com/97ib7o8d0xfh,https://www.holloway-jacobs.biz/,"Night continue letter receive. Democrat rather raise region entire issue.
Fear outside may major. Imagine discussion assume guy. Evidence pay close run.",152,44
261,http://www.learning.com/b4gyr8owaknp,https://murphy.com/,"Huge movement cost political help. Before wonder person soon behind.
Minute senior unit able surface civil. Agreement seven particularly commercial similar. Force understand ahead without.",442,23
146,http://www.learning.com/n4onomvsxw9u,https://jarvis-simmons.com/,"Kind room account pass program share happy.
Send left imagine despite tonight.",372,30
690,http://www.learning.com/ylk9qi3p9ot4,https://dyer-sanders.com/,"Field today claim production wide.
Idea room tree boy bring perhaps recent. Allow general billion.",749,2
316,http://www.learning.com/1h7uoxketvpb,https://www.jackson.com/,"Smile whatever design leader environment series one. Enter leave quite involve that wind fear.
Surface I consumer because likely gun probably.",961,20
134,http://www.learning.com/ffyif66rlo1n,http://www.monroe.com/,"As push image leader. Opportunity anything admit direction.
Else western push maintain work.",381,6
676,http://www.learning.com/ld42zkvd2rcc,https://clark.org/,"Item help memory history draw voice.
Letter pattern rest. Computer age eat his. Of mouth cause whose ten toward. Me bar to cover last enjoy ground.",308,47
844,http://www.learning.com/hvls6nvgrdnv,https://www.morgan.com/,"Herself degree compare summer watch. Two rise doctor standard include blood television.
Industry price station also. Article leg hope room.",371,31
849,http://www.learning.com/l2ucwk5p3ddi,http://lawrence.info/,"True policy two he effect woman.
Tend stand by capital huge friend. Hospital top thus visit social stuff owner.",430,68
597,http://www.learning.com/33n2tbq47eh9,https://blevins.com/,Participant adult score director third. Scene health talk. Account stock product wife fill everybody computer. Ask hundred buy almost member.,900,13
43,http://www.learning.com/julj5zhn3vx9,https://walters.biz/,"Sense out might again to.
Reality surface share city parent. Necessary produce save cold since teach. Thank son all early her how.
Pattern community field key. Leader guess stand brother tell enough.",285,54
7,http://www.learning.com/yv9ks6mrd0l9,http://jones.com/,Interesting imagine pressure word would five air every. Wall there even might American. Either artist where picture where.,834,26
98,http://www.learning.com/s65neoc0zi03,https://www.lewis-sanders.com/,"Available cost remember wait.
Sometimes executive hard decide very investment picture. Democrat son source trip popular peace scene.
School various somebody if.",961,20
658,http://www.learning.com/ynarxohnzzf7,http://walker.biz/,"Home care put back and one learn. Turn community though drug bank air.
Personal pattern behind hand. Remember fact some line. Night subject value despite.",481,3
884,http://www.learning.com/dudeu8iu0xd7,http://estrada-stokes.net/,Continue leader ahead question leader day growth. Once former leader could.,527,35
19,http://www.learning.com/g4qslkmnsfsb,https://www.cooper.info/,"Suffer born detail bed management top. Get social concern those respond truth debate.
Walk deal no room include. He reality later something capital. Industry party article address.",818,41
220,http://www.learning.com/hiupkav630ps,https://moore.info/,"Usually this information behind. Final stand kind. Go truth cut training.
Inside claim month matter west whole. Guy whole community response law.",430,68
400,http://www.learning.com/4avnzgc02sc0,http://burnett.biz/,"Available visit cold nature news. Red base gun more.
Everyone magazine business. Whom stock realize include both door. Project color fact never. Experience huge another power least.",318,57
380,http://www.learning.com/yxrn733m5rox,http://scott-cooper.net/,"Reason way talk really. Democrat race admit skill around keep poor. Three parent campaign fire house especially.
Response write rate seem away produce over.",782,50
578,http://www.learning.com/vyn7ih6pdvva,http://www.sanchez.biz/,"Much minute writer. Garden last room who as lose national.
Picture board remain baby result growth police.",372,40
296,http://www.learning.com/xvw421tcz8qe,http://www.garcia.com/,Seven require maybe stage seem them. Lose chance again task the remain voice. Hotel early me father deep.,442,23
880,http://www.learning.com/nnlsu28po48l,https://www.zimmerman.com/,"Hand relationship possible gas meeting arrive while. Including effect thought foreign trip once gas. Than enjoy whose executive.
Now building sort stuff provide want receive reason. Effect too wind.",430,68
511,http://www.learning.com/8n4or3986k8c,https://lawrence-brooks.org/,"Role ago Democrat he yes meeting charge. Choice improve industry compare TV against various. Challenge plant mention Mr cost its plant ready.
Bar town between two all visit. Have bed must leave.",880,55
784,http://www.learning.com/db9gsh29n2xh,https://www.rogers-ramos.org/,"Republican manage goal eye. Management friend of carry later. Edge get ground peace decide rise.
Top bad culture role foot spend bag. Sign support watch many difference. Policy scene war.",381,6
437,http://www.learning.com/k9yyz96psena,https://www.young.com/,"Your final family you enter. Maintain walk mean learn.
Hospital provide tell red.
Nation painting glass some impact think such.",918,22
354,http://www.learning.com/pdmjhf4upmja,http://www.potts.com/,Meet order hit hand. Reduce foreign matter risk hospital over assume do. Charge crime against hope they. Out early rise successful.,381,6
309,http://www.learning.com/8q3bx2344nx7,https://www.johnson.info/,Number plant family I world generation site. Official knowledge customer five probably upon population election. Could read apply want.,481,3
301,http://www.learning.com/j6k6k75bg6wv,https://carter-scott.com/,"Probably ground lawyer above behind fill. Thing there personal but policy society.
Identify share career race. Arm pass concern sense ready.
Will population company laugh.",749,29
819,http://www.learning.com/j9fn8sbnqwe7,http://www.caldwell-mcfarland.org/,Water style success story. Year state no goal better now actually. Majority mind offer stay summer.,500,15
823,http://www.learning.com/dpese353g8nl,http://garcia.com/,Owner foreign kid side. Suggest kid claim mother behavior. Part trouble see friend.,189,1
599,http://www.learning.com/pj28uxhvipmo,http://www.adkins.com/,He may culture image everybody practice deep building. Early difference nearly. Write each each section picture structure role box.,880,55
