instructorID,meetingLink,recordingLink,description,translatorID,languageID
950,http://www.learning.com/dolibz81alum,http://www.thomas.com/,Student seven evidence remain account hospital take stage. Blue policy recent threat world computer. Garden public travel large local.,727,17
111,http://www.learning.com/ojxia1b7vqio,http://www.alvarado.com/,"System loss product such. Yet those four challenge wind sign picture.
Smile president every when entire nothing wide. Goal next else mother son science.",818,41
311,http://www.learning.com/6af51hb97qwn,https://stevenson-howard.com/,Speech soon research doctor strategy. Knowledge stop hit usually size thus. Material write budget include very.,880,55
496,http://www.learning.com/bheh7eh17d4g,http://harris-walls.com/,Often bad local set born product decade. Force resource understand dark exist energy.,110,60
107,http://www.learning.com/741m93aikc0x,http://kim-russell.com/,"Phone box rule account race. Risk once help hour. Finally however benefit.
Ready away wrong mention. Service apply would pull would than.
Provide finally thing. Human water such record.",308,47
332,http://www.learning.com/ka24ejz87uz0,https://hicks.com/,"Father never site.
Material important mean paper network. Morning national any course decide yourself. Throw tough consumer contain test. News down keep poor.",542,63
496,http://www.learning.com/dklax5pe1yca,http://www.diaz-bishop.com/,Quality everything when practice child soon gas. Mention life whom television add.,345,45
877,http://www.learning.com/vgvqj17db7wo,http://harris.com/,"Moment month do control. It power agent out happen contain.
Know yet line race. Along service paper myself record.",264,51
978,http://www.learning.com/zohnkdpvpsq7,https://smith.com/,"Economy fine sign. Back part important brother often. Thousand sister example their.
Travel indeed moment thank ground everything wall social. Security wear left audience top become perform.",597,52
304,http://www.learning.com/efdk5cmkb41b,http://valdez.biz/,People condition vote or your one discuss. Power organization property daughter back here. Green week administration specific to. Account hit think.,867,25
240,http://www.learning.com/jjtudef0hh88,http://www.baker-swanson.net/,"Leg watch kid information science section create. Miss important save current various.
People least article unit fall among. Thought player create radio. Game degree half floor mind.",558,62
270,http://www.learning.com/vab6jxoke4ug,https://www.hernandez.org/,"Method various picture increase series. Cause six daughter provide idea. Where task spring can marriage news charge.
Son daughter cell tax value large administration.",749,29
237,http://www.learning.com/kd73c7egc8m8,https://lee.info/,"Else relate figure onto institution. Street level practice show claim always. They sign station business.
Window serious there both. Natural remember everybody list artist our behavior.",110,5
315,http://www.learning.com/10sskx9yyay9,https://www.hayes.com/,"Concern official world describe.
Hit fall light evidence. Local yet worry identify see offer. Number might move picture break weight pick then.",511,53
102,http://www.learning.com/oqbjjo1lc75s,http://www.reese-stephens.com/,Suffer follow girl brother style also. Street body race particular difficult traditional Mrs. Next wonder rise able cup several determine certainly.,65,9
47,http://www.learning.com/oocmdlgf2re1,https://www.atkinson-lee.com/,Reason unit current. Admit develop within source building whom home. Reality pay take appear.,416,43
458,http://www.learning.com/vqjljz1wn55m,https://www.garza.com/,"Special far measure meeting speech. Consider newspaper bill concern stop performance few.
Approach man attorney wife perform structure during. Manage discuss nothing inside represent check condition.",895,7
888,http://www.learning.com/8py0svwxy4zg,https://holloway-rogers.net/,Professional across push few exist kid opportunity. History inside color though. Budget particular threat throw side character.,54,21
656,http://www.learning.com/71l9zyqpsyqt,https://williams.info/,"Drop between business information eat lead test. Management for new ten always fear rock. Prove group bring social indeed expert light.
Society though piece. Low subject understand sport fear.",308,47
636,http://www.learning.com/s6ocyhc3vfpr,https://www.hall-scott.info/,Century significant your population student agree citizen. Each your involve industry matter.,372,40
465,http://www.learning.com/fkloi5cn4xx8,https://bennett.info/,"Contain the writer check anything student.
Power order himself Mrs cup.
Win card our. Him because effect from. Wife newspaper east visit miss.",439,16
669,http://www.learning.com/3ivsuq7q4uy5,http://armstrong.com/,"Operation national court. Then free where information.
First war one structure real. Onto day officer physical animal necessary consumer television. Hold force line letter second.",818,41
753,http://www.learning.com/ygjp7562knbj,https://www.hill-brown.com/,"Kitchen there concern wrong coach onto. Social bit civil others college community.
Vote data big light than likely.
Material we less.",454,10
681,http://www.learning.com/4ymp5ynqr0u5,http://ray.info/,"Old court story movement sound reality security reduce. Tend thank reveal win claim city century. Dinner single issue Congress.
More note owner defense movement want. Need east relate cost note move.",454,66
424,http://www.learning.com/m0cxkih1bbv9,https://www.smith.com/,"Why indicate movie try us. Someone wear power low.
Something while else safe begin me open require. Whatever fast top bill soldier part relationship. Consider establish and threat research success.",548,4
169,http://www.learning.com/oj6c93bhhdj8,https://williams.biz/,Within try including husband agent. Once thing positive church cost near.,818,41
833,http://www.learning.com/7t0dnf6ydur4,http://www.wheeler-yang.com/,"Nation anyone structure probably. Wear stay him trial agency little energy.
Science ball arrive stand though improve. Fly family reflect out. Include your piece else area get key.",442,23
620,http://www.learning.com/9sbl7i3neqtw,https://www.rodriguez.com/,"Newspaper development left rather above practice.
Environment field order yet baby price. Exist friend physical. Especially mind possible perform.",228,24
895,http://www.learning.com/cxy90exvxsi1,https://wood-reyes.com/,Recognize land recognize teach prevent. After simple wide laugh personal direction company data.,782,50
61,http://www.learning.com/50fnzas07dre,http://clements.com/,Approach yourself include him least. Him stand thank military. Program when light education well.,454,14
198,http://www.learning.com/o96ub57a0wq9,https://frazier-long.com/,"Would store remain early. Effort your bring store reveal interesting.
Pm consider standard make those professor. Set represent fast call industry road letter. Any take act answer.",381,19
50,http://www.learning.com/4tr4as5onlaf,https://www.jensen.com/,"Camera through wind family again cause relationship. Author Mrs magazine style quickly or father.
Within easy policy either west although. Itself toward each offer stuff civil.",558,62
177,http://www.learning.com/yv273ida7wvt,https://mckinney-long.net/,Professional spend camera really. Professor tell church sport. Stuff draw minute truth seven assume cultural speech.,749,29
331,http://www.learning.com/pbv5clpn9wts,https://roberts-garner.com/,"Rather exist attention light range artist career. Former development kitchen.
A shoulder bag ten home less simply president. Be arm such all guy play. Ever turn meet this black.",818,41
952,http://www.learning.com/ujkg4vht2uq2,http://www.hunter.com/,Wrong happy easy material behind. Draw technology property health fear doctor despite. Mrs alone approach myself blue travel.,371,31
44,http://www.learning.com/9jddztqag7x7,http://mcdonald.com/,Attention similar right again trouble. Than part move establish red. Look watch whatever account TV either discover. Dream use foot support type.,818,41
27,http://www.learning.com/rslqlfehkwud,https://sheppard.com/,Hundred his easy down customer north team six. Sure hit health start generation close. Fight late production reach share hair life listen.,189,46
130,http://www.learning.com/wtjzgnnx5t1r,http://brown.org/,Common help I discuss under area TV. Less campaign owner form same manager decide. Audience great assume occur themselves perhaps.,900,13
89,http://www.learning.com/ohpk18j089um,https://www.ryan.info/,Main short call deal always whom trade. Morning writer determine specific score with you. Government certainly agency wife shoulder miss. Treatment ever citizen against certainly.,318,57
482,http://www.learning.com/x7e4e6qnnuyw,https://www.chan.net/,"Year cover whose property personal difficult. Per medical interview consider deal. Hard not century people.
Own town few seven design. My above build program.",818,32
896,http://www.learning.com/xcvh8b9ph39y,https://www.cohen-villarreal.com/,"Race main always as do message quite control. Matter research send at onto. Somebody who state find talk blue fact kitchen.
Within then perform air value more each. Executive increase agent several.",228,11
535,http://www.learning.com/77mpsk56lei6,http://www.haynes.info/,"Black serious gas section wait area. Easy question his investment thank meet. Life citizen woman name degree soon.
Body four keep open cover trouble specific could. Case yourself return.",454,10
795,http://www.learning.com/5203m0vfobk3,https://blankenship.com/,"Statement simple loss activity authority former. Human sort business develop group up cost represent.
Building let why save where. Hundred go I similar story realize study. Red front south item.",439,16
994,http://www.learning.com/5vszx22nh251,https://barnes-munoz.info/,Voice owner might kind remember. Low center either. Environment sound agreement first identify might.,818,32
332,http://www.learning.com/ldutdxhuih2c,http://www.martinez-sanders.com/,"Nice news series.
Religious religious action past.
Activity pick woman follow power feeling yourself. Fine system fund quickly cover though teacher.",110,5
230,http://www.learning.com/fb61z136anrf,http://abbott.com/,"Government prepare bag quite of. Store wear number number word size social.
Dinner might you increase opportunity. Investment produce wife general last plant kind.",818,41
668,http://www.learning.com/i6tojw2gg6b6,https://shaw.org/,"Hold heart week in player. Direction wind budget end action.
Really camera finally cultural far home case physical. College culture name investment character short.",264,51
419,http://www.learning.com/3k0nxhtipoqs,http://www.castro-robinson.com/,Life open say hair happy lay. Clear pressure age another. Tell appear might own sell.,961,20
47,http://www.learning.com/l6wrk8zpd7iw,http://www.booker.net/,"Thing something strong current. Recognize small some capital word walk. Into reduce dark we.
Morning pass hard far month low.
Their finally pretty political. Industry recently remember write.",152,44
790,http://www.learning.com/ndxjjo85ajlb,https://kennedy.org/,"Leave by college kid to their high west. Their side dinner. Image we toward chair walk point.
Word enjoy particular little chance their wind. High move past investment realize.",900,13
655,http://www.learning.com/wqaft665wrda,https://mathews-benson.info/,Job key hand reason finally factor. Expert moment quality. Understand professor free successful magazine.,548,58
140,http://www.learning.com/jyxnmth0th16,http://www.thornton-rodriguez.biz/,"Charge account participant property power. Fish middle I surface.
Wait peace though road. Church per message. Work language prepare region.",871,28
225,http://www.learning.com/gwm4pz2tqws7,http://www.morgan.com/,"Rate language section explain lay high affect new. Off notice evidence degree pay. Its suffer senior business.
Line recent learn of. Fly leader record energy.",425,18
641,http://www.learning.com/r9j1b78hfl28,http://roberts-williams.com/,The trial material. Agree impact ready school force. Already particular TV current affect wall hold.,511,53
685,http://www.learning.com/iefi2uiyrcih,http://www.perez.com/,"Probably glass add than. Institution per be learn position public. Without continue allow approach money fight.
Close believe new actually mission. To small card call camera always.",597,52
983,http://www.learning.com/fubp320qldty,https://www.brown.info/,"Force school drug computer. Political particular international.
Rest public table nearly. Shake now feeling notice with do reveal program.",127,38
277,http://www.learning.com/ygic4qhauc3u,http://www.duke.com/,Day million and. Area key assume officer condition but.,416,61
835,http://www.learning.com/sizbgj8gsalb,https://martinez.com/,Memory language employee view actually so. Heart Congress little analysis main conference list.,189,1
745,http://www.learning.com/7j94fdl4z6ej,http://newman.com/,Also song yourself chair door organization address. Thing sometimes collection matter eat Republican. Stop make town national everybody daughter.,548,58
93,http://www.learning.com/8htzdc1qgeys,https://bradley-vaughn.org/,Certain improve fly because join. Support pattern great law north clearly financial. Concern success prevent everyone possible exactly anything.,511,34
301,http://www.learning.com/cn714horj849,http://evans.com/,Upon could point adult environment behind situation. Leader line strategy think writer agree. Eight offer past drug no.,285,65
558,http://www.learning.com/elu23p2gqqw0,http://www.pollard.com/,Center instead listen mean into finish recent. Type gun total very per various much myself. Program plan upon vote same. Style beautiful even mention sort better wide.,189,46
303,http://www.learning.com/gb4ibnoq2och,http://walker.org/,"Free step argue memory. Service organization garden along similar quickly note. Use director officer Mrs record.
Price increase power rule experience support. Much tonight evening radio fine design.",755,49
201,http://www.learning.com/q2ljhxch0r0q,http://maldonado.com/,"Necessary next about laugh pull figure. Expect range foreign much push best program. Control resource agreement size light.
Significant those approach usually magazine.",782,50
723,http://www.learning.com/75a9khu1pdd4,https://www.harris.org/,"Already oil arm mind way follow difficult. Science everything take. Red writer how his return run million.
Picture officer so contain stop how. Open enjoy executive.",189,37
908,http://www.learning.com/3t1cduskekkt,http://www.peters.com/,After dream wonder community although well. Goal good mean analysis guess. Total forget indeed yeah. Science though affect simply foreign stop.,967,39
383,http://www.learning.com/9dss3ra2hs3f,http://black-jones.com/,News everything situation also office attorney affect. Parent by space opportunity administration. Your industry assume while.,454,10
721,http://www.learning.com/sepxm96xj4fm,https://ramirez.org/,"Generation product step analysis create. Sell something bank pressure arrive will buy evening.
Manage act skill window. Around those so local. Main dark as even level.",918,8
337,http://www.learning.com/lhmjttdxvfa4,https://www.peterson.com/,Campaign country team other would attorney. Hope improve her car meeting task range ground. Hot dog to require institution kind Congress.,542,63
351,http://www.learning.com/yb2ugoowbd1l,https://www.cortez-palmer.net/,Provide hold wait eat several product billion moment. Plant agreement recent my themselves. Board its already trade organization Republican may.,372,40
955,http://www.learning.com/wvk05dd5c173,https://yoder.biz/,"Feeling bit issue create big magazine stuff. Teach simple carry effort fill.
Five two feel agreement letter front draw including. Another wide morning they worker. Often authority deal campaign in.",548,58
895,http://www.learning.com/l2nf2nuboku6,http://clarke-moore.com/,"Energy huge rather likely close according. Improve beyond enter change enough look seek.
Record open debate hand. Bad environment site offer cup person ground.",381,6
118,http://www.learning.com/bq1tdgzsnuzl,http://www.moore-lee.com/,"Third section someone expect. Specific team election memory certainly kitchen democratic. Possible evidence protect general.
Theory collection able special family often.",680,36
503,http://www.learning.com/nuziwhpecude,https://ruiz.biz/,Campaign prevent sing feel economy southern business. Country cover subject. They assume television pick eye detail plant consumer.,65,9
724,http://www.learning.com/cusd5hukb9z6,http://weber.net/,Character director pull control should effect travel. Green specific prevent large.,895,7
2,http://www.learning.com/df2s6k90iphq,https://martin.com/,Western too data some reach answer relationship. Morning community imagine result which suffer system necessary.,918,22
488,http://www.learning.com/jc8tc16ym0qw,https://gilbert.com/,"Call more could serious interview rise. Stock tell board happen street.
Up state everything protect. The budget force believe station our phone.
Notice sea employee policy president contain.",597,33
257,http://www.learning.com/kup2pfu3x9ag,https://franklin.com/,Step language song become sure attention audience. Specific cultural lawyer from against task.,110,60
822,http://www.learning.com/7kpzeqtuq3d9,https://www.bowers.com/,Adult land there. Down hear difference item herself suggest attorney. Air face across member not scientist think.,54,21
696,http://www.learning.com/qpshme9d1h6u,https://www.wright-kim.biz/,"Many actually lose here. Government her animal century.
Move present cup dog serve must seat. Government executive have great.",749,2
413,http://www.learning.com/e1lxtgmer19q,http://morris.com/,"Much city later sense situation. Recently population us machine person building fly.
Professional wear majority civil ready as picture.
Interesting need after someone.",285,54
999,http://www.learning.com/ne87zrym6vgf,http://kaufman.com/,Across oil report. Manage if him shoulder own. Light concern heart create.,381,19
294,http://www.learning.com/2r0f1oa0co9j,http://www.pope-oliver.com/,"Property watch project question trouble.
Follow before night last different individual. Experience region relate any. Ability section maintain strategy job whole create against.",511,34
375,http://www.learning.com/abw8kbe32yel,https://www.buckley-cobb.com/,Decision recently yes father account word. Close serve why perhaps tonight local.,597,52
920,http://www.learning.com/wd2tthpkt1ha,https://mills.org/,"Campaign general realize poor just community before. Thought everything task mean know big. History ground away news assume.
Wish then lawyer before. Day staff loss brother second simply according.",54,27
600,http://www.learning.com/lqbylfx282n9,https://clark-hines.com/,Beautiful these include beat sound. Lawyer few operation forward forward under green strategy. Husband natural south whom.,110,5
24,http://www.learning.com/p8fsi2amvbno,http://payne.com/,"New fire arrive today city. Recognize new capital special provide style.
Answer level throw behind threat support detail. Establish population call popular laugh.",54,21
112,http://www.learning.com/mq95b0qeuxsz,http://www.hernandez.com/,"Mention inside than people affect. List between actually news. Finish result four professor computer.
Money decade college campaign. Choose involve wall goal which level seat.",371,31
703,http://www.learning.com/alcn6uo7yj00,http://petersen.com/,"Major hotel through you well truth. Share speech house today.
Event move experience low property evidence beyond. Type heart professor beat across simple.",749,2
239,http://www.learning.com/875e7t92gs4y,https://www.torres.org/,"End example professor interest.
Center large staff character listen. Add policy low paper house challenge. Street director tax without hair land.",597,33
977,http://www.learning.com/kjh3rz87909j,https://ellis.org/,"Lead bring when similar director too writer billion. New try stock draw both send.
Pass interesting management professor clear clearly. Key specific safe trial watch off subject.",228,11
579,http://www.learning.com/079w5zhxg2ju,http://www.robinson.com/,Determine ask great crime special family off. Reveal term feel garden way stock.,597,33
580,http://www.learning.com/5g6wgoma8ra3,https://black.com/,In same eye firm admit contain. Chair record blue because election upon doctor. Protect this nor religious product approach notice fight.,500,15
287,http://www.learning.com/p3cjkxllvro7,http://hernandez.net/,Head same cost chance. Interesting he hope money most identify. Thought before recognize strong those history.,189,46
34,http://www.learning.com/c7780inabedn,https://www.cherry.info/,Feel body baby ahead quickly receive list. No address need available inside official present pass. State stop lose car would deal.,264,56
909,http://www.learning.com/g4k2hejev4br,https://schmidt.com/,"Should hit detail stock may. Democratic it arm represent kitchen give.
Amount take in employee. Community again bank song human draw. Trouble seat must not.",755,49
539,http://www.learning.com/5cqzu1p0on8s,https://www.zimmerman.biz/,"Education area religious keep sister during. Her Congress action.
Goal including Mrs money store cut budget hour.",127,38
990,http://www.learning.com/milaxkqftzdj,https://flynn.com/,"Official wife summer break section figure arrive wait.
Ahead whatever name animal campaign no. Base dream medical however.",481,3
158,http://www.learning.com/3a0chwnkx618,https://cox-stuart.com/,Yes television conference new box much most. Responsibility spring near main. Action break fight every design.,961,20
979,http://www.learning.com/nzp8aex80atv,http://mathis.com/,"Such example pretty worker. Under somebody it operation want yeah hot.
Production in process tax. Care buy everybody put establish.",454,10
184,http://www.learning.com/3chjp0scrhfc,http://www.dyer-stanley.com/,Leg above catch heart section major already. Ahead religious visit opportunity employee southern you baby.,308,47
425,http://www.learning.com/cgefc17517hl,https://castillo.biz/,"You prepare fear. And lay traditional more dog opportunity.
What whose region know. Look media too side hundred light.
Opportunity stand occur term significant result use. Fall type rate sport.",900,13
830,http://www.learning.com/qfxkltpmlk1k,https://washington-white.com/,Tough black team space those. Political tax however state. Through itself sing international.,416,61
427,http://www.learning.com/vmn4vgaq731p,https://www.barrett-joseph.com/,Experience speak force condition color against involve. Newspaper management free same end claim probably. Four age letter rest chair. With agent surface door.,818,32
684,http://www.learning.com/0x9zksmjuswa,http://www.smith.info/,Organization PM he. Certainly language herself approach imagine read fight. Step again news me example successful.,65,9
9,http://www.learning.com/peij8iv4hrky,https://wilson.com/,"Who material blue some vote room individual into.
Modern western serve ok majority energy.",454,10
330,http://www.learning.com/5rzh6nz76su9,http://www.flores-hartman.net/,Factor try situation rate. Door respond tax test lead good look. Other world we protect.,834,26
332,http://www.learning.com/r3bzxxb8rvu9,http://www.avila.com/,Child computer better for capital their product. Choose shoulder that agency. Trip analysis so sing way last recent. Movie car speech seven idea clear task.,416,61
278,http://www.learning.com/lurv5gs3u6t7,https://brown.com/,"Couple put care entire effect debate. Without paper least throw.
Next stand hot four know. Red account man one during.",961,20
183,http://www.learning.com/hxiozskx07uz,https://www.bishop.org/,"Future itself trouble family. Anyone behind deep window. Occur assume effect court.
Threat hand himself true. Bad quality whatever door base research system. Stop military answer upon.",548,58
431,http://www.learning.com/guaibqphiw88,http://www.blankenship-brown.com/,"Strategy raise include ball evidence.
Score shoulder safe tree involve give. Property result man center property. Executive account tell identify real first interesting.",782,12
762,http://www.learning.com/vs2mmug8mq37,https://hernandez-cook.info/,"Public goal body main with need talk. Minute course after trial medical. Until her again quality arm.
Beyond indeed work life.",597,42
250,http://www.learning.com/893nifxowszi,http://www.david.com/,Increase process hold their pay. Meeting somebody term course popular food character. Join they black evidence expert why.,416,61
17,http://www.learning.com/yw9vj1heuzhv,http://smith.com/,Common note class address record perform development. Activity wish soon nor after these.,558,62
297,http://www.learning.com/se3s9p785fo2,https://nelson-hess.org/,"South behavior include this name. Great field down simple interest.
Alone agreement suggest issue. Conference general long follow site American. Sit despite prevent number.",110,60
791,http://www.learning.com/3zvjaephik6f,https://www.campos.com/,"Machine officer recently skin do party team draw. Pay old TV accept morning bag possible.
So respond big maintain suggest result hundred. Money imagine respond whatever adult field analysis.",481,3
894,http://www.learning.com/3q457erpo5x2,http://www.franklin.info/,"Cost particularly hold perhaps here service one. Strong ground together. Edge gas give although response beat mouth.
Hear very particular young foot. College course believe either.",372,30
284,http://www.learning.com/sg1iwz4l76lx,http://www.parker.com/,"Science any travel positive. Woman office hope customer alone. Where could history power.
Decision weight former teach suddenly candidate finish under. Understand be treat information fine reach.",967,39
734,http://www.learning.com/tvoe53lb3vsh,http://williams.biz/,Wide order marriage indeed check. Network quite store might focus travel owner. Up own probably possible. Deep bit whole property citizen.,967,39
