instructorID,meetingLink,recordingLink,description,translatorID,languageID
531,http://www.learning.com/l48rdzgmh3ju,https://www.fuller-lopez.com/,"Trouble realize show.
Visit guy floor level pattern you husband. Less themselves citizen difficult friend return site.
Important drive daughter painting long assume. Season bad age figure rise thank.",264,51
988,http://www.learning.com/8e4zcho6fx30,https://www.nicholson-miller.com/,Season most good nothing program speech option. Any fear open party half Democrat. Make wall court recently attention discuss level nothing.,481,3
860,http://www.learning.com/wo6qdorvh9zs,https://henry.com/,"Ground science tonight get situation late put.
You behind grow determine beyond push. Continue listen right ready effort trade key defense.",430,68
431,http://www.learning.com/813sh77357pv,http://www.thomas.org/,Participant commercial trouble prevent. Executive top hand participant family. Total agreement field none drug then board.,65,9
947,http://www.learning.com/riz8icuco0rd,https://www.allen.biz/,"Buy about PM major Mr claim. People manager night stage.
Minute final plan. Treatment team reduce indeed no.
Difficult become product trip find region perform.",442,23
53,http://www.learning.com/jyvfvenun6ga,https://www.hunt-martinez.com/,"Pick idea report area clearly. News land enjoy cost local player.
Add approach not nor seek sport. Without cold call evidence simple claim. Increase shake wide guess.",454,10
706,http://www.learning.com/14155aceg1ce,http://gentry.com/,Much partner everyone few offer those middle. Beautiful value since around. Strong camera north control real thus.,527,35
801,http://www.learning.com/2d8fszjml2wz,http://king-jackson.com/,Focus sell mind center she continue. Mean anyone avoid determine choose.,425,18
940,http://www.learning.com/qcj6tbyvm3jd,https://serrano-thomas.com/,Read through instead produce. Response make president training happy. Skill international improve air weight.,439,16
240,http://www.learning.com/gn58iatme4fm,http://www.spears.com/,Black process at increase. Much better laugh eat painting. Drug often character writer color control.,834,26
759,http://www.learning.com/6e2vb6jtzbgm,http://www.french-daniels.com/,Authority ago way such able most may. Everyone concern imagine their. View tree anyone weight little husband save.,110,5
505,http://www.learning.com/mcdbyl1q783r,https://www.johnson.org/,"Respond player military very scene think. Ask break economic believe of interesting.
Idea card section candidate woman since. Talk there market.
Employee amount yet capital wish while product.",749,29
46,http://www.learning.com/fqiccghermae,http://www.banks.com/,"Wait why would rather create. Night career chair color. Do life speech building. Base ahead position buy any.
Drug law personal sense. Consumer base civil risk pressure. Become material impact class.",371,31
648,http://www.learning.com/12dkjkup5a83,https://www.gonzalez-wong.biz/,Debate manager able on staff spring. Way other reflect war purpose body.,454,10
95,http://www.learning.com/a8lgjpz45en2,http://clayton.info/,"Accept reflect listen argue movement. Too money up will interest special. Now course mind pick.
Increase bed worker stock feel entire present. Gas born along operation memory charge who.",597,33
475,http://www.learning.com/r2gqo710g5jo,https://carroll.com/,"Should fear parent investment alone. Ok under will here send area party. Nice produce picture night fall.
Customer early long rise hospital. Full across after surface paper.",308,59
655,http://www.learning.com/orwkas4xzaq9,https://www.reed.com/,"Week hot safe capital direction. Religious image test mean. Executive say we operation fear for.
Senior ago space success break.",189,37
709,http://www.learning.com/6ut4u04felry,http://www.peters.com/,Play activity product thing address he too. Forget sure charge window reduce. Develop class system may.,110,60
137,http://www.learning.com/n88ggeib4dh6,http://www.mckay.com/,"More mean develop than fill show. Another region since range recognize education surface.
Become tree beautiful tonight head fish floor.",597,52
797,http://www.learning.com/utugu6tisi2a,https://www.rodriguez.com/,"Power throw represent big light. North fill knowledge force impact standard own once.
Give computer list. Difficult seek provide kid we.",481,3
596,http://www.learning.com/0g7m3nklag5q,http://www.lee.com/,Behavior run amount people matter admit quality clearly. Thus argue also future through various leader.,189,1
534,http://www.learning.com/p3bnzc0yippg,https://callahan-pierce.org/,Gun dark speak generation ball. Conference power their use foreign before remember. Debate discover poor soldier hear forward company.,454,10
196,http://www.learning.com/oap15on04jkf,http://www.ward.biz/,"Affect risk technology sea education also must. Phone quite lead arrive public. Green generation area weight.
Everything account good land.",749,29
471,http://www.learning.com/rvgyhpwoa5a9,http://www.rodriguez.com/,"Then next charge determine born those. Arrive develop either meeting them seat plan strategy.
Discover water weight reason something sort. Someone student space tree pick start read.",454,10
71,http://www.learning.com/jh372guxswgq,http://elliott.org/,"Imagine kitchen sign value moment. That region knowledge about. Little decade than tell these all letter prevent.
Foreign but example. Physical range activity economy.",371,31
582,http://www.learning.com/zggnvk906nxw,http://www.hoffman.com/,Involve drive suggest cost. Actually itself per onto. Including near begin nearly speech. Big prepare pay thus movie.,597,52
772,http://www.learning.com/n5sr2cem7q8p,http://davis.org/,Stuff evening century between degree occur. Police participant stay hotel radio. Very wife treatment possible hard leave free.,285,54
648,http://www.learning.com/jbfvtqemx0rl,https://www.walker.net/,Drive follow whatever similar do. Cost read anything food these. Many past college gun Democrat rest market. Cultural compare top value section thousand area each.,542,63
728,http://www.learning.com/aimiks8xth7r,https://www.gomez.com/,"Popular everyone upon foreign. College sound citizen listen happy wear no. Everyone husband four.
Street than worker. Out them race director tax receive.",65,9
423,http://www.learning.com/h112kwcmdpuf,https://www.robertson.com/,Money data bag street less option everyone social. Five garden theory guy every. Food similar personal teach base with.,548,4
494,http://www.learning.com/v6yy627mwjn5,http://www.johnson-nunez.info/,"Standard animal agency. Reflect base case owner employee certainly whatever.
Draw practice care response one own follow more. Situation believe decade author.",416,43
103,http://www.learning.com/hp91kxaldksu,http://www.perkins.info/,System civil suggest. Weight unit action keep early administration. Act bed nature voice make factor.,416,43
216,http://www.learning.com/6dqg1dkwlce8,http://www.fowler-howard.com/,Suddenly onto enjoy true. Recent away worker involve capital for painting. Else leader part attack according gun. Notice type between today.,961,20
131,http://www.learning.com/91a9p7nwvwln,https://davis-wilson.com/,"Player kitchen single state before. Onto white region specific group. Century record ok community.
Window after chance what north raise perhaps personal. Else author only task yes. Show might people.",425,18
178,http://www.learning.com/or6bp6ngwysn,https://mason-diaz.com/,"Authority right son course after third. Report letter despite about themselves exactly statement. Especially east defense.
Save political move but. Gun strong reduce fund moment color citizen.",372,30
328,http://www.learning.com/gmp23w8en2c8,https://smith-delgado.com/,"Sort speech account professional government record help himself. Task wide win thought table. Strategy want talk value natural why newspaper.
Old at simply pretty. Walk late thing he never.",285,54
298,http://www.learning.com/84sz7dy74q27,http://summers.com/,Street player he bring determine. Truth read indicate how true affect. Threat present every send.,439,16
397,http://www.learning.com/art24ciedxfu,http://deleon-kramer.com/,"Down size likely on. Control south week girl.
Mother ok light environment seven public. Coach station party represent.",511,34
828,http://www.learning.com/syer7bq9c01y,https://johnson.net/,Phone other clear performance often. Per product hit summer program debate make. Well face actually town board close despite.,189,46
518,http://www.learning.com/yptx08ij7bhb,https://www.ellis.com/,"View school or upon. Language them model how. Prepare will minute lose sell.
Yet almost story five. Guess than group any. Suddenly cold hair write billion.",782,50
840,http://www.learning.com/9a4x1xs227ba,https://www.mcdonald.com/,"Care parent show ask bit hit leg. Group say though not specific represent agent score. Brother hand ten.
Great decade then among play road friend.
Present city ago sort dog popular.",782,50
26,http://www.learning.com/4p1ksdjipktj,https://allen-ballard.com/,Bit edge particular generation teacher. We talk house want.,110,60
363,http://www.learning.com/2amhnmj4ay7i,https://www.smith.biz/,"Hear night yeah film institution. Ability theory wonder give itself north resource.
Better indeed bar human choose vote. Single trouble defense minute economic.
Reveal think western run.",430,68
811,http://www.learning.com/rd3laieybxsw,http://rodriguez.com/,"Of behavior somebody although else television. Place black represent control final type.
Method ago require parent great approach rate media. Night culture including operation through.",189,37
818,http://www.learning.com/22iltahis50q,https://edwards.com/,Account fire blood room industry notice. Site animal age organization onto. Structure whom western think during.,900,13
455,http://www.learning.com/p1af2ac0hjtc,https://patrick-sweeney.com/,"Thought group star indicate today difference.
See join employee. Level one skin continue leave history shake. Attack away attorney leader toward compare low.",834,26
889,http://www.learning.com/5sgvwha95ds1,https://johnson.net/,"Whatever because many official necessary to ability. Recognize stand so who if walk air lose.
Way establish morning our building develop talk way. Hit less Democrat capital teach.",308,59
827,http://www.learning.com/3d75j4c68mfh,http://hill.net/,School fall power. Space lawyer newspaper image receive prevent material. Catch again pick glass matter.,308,47
317,http://www.learning.com/4ojvas1hcu4l,http://douglas.org/,"Above ground very science. Leader Republican movement bill son whole.
Medical company interest good something. Improve over me suddenly wear term.",54,21
813,http://www.learning.com/6yx1nmhl8n2s,http://lewis.com/,Suffer front may sometimes respond walk. Modern range address audience remain sign hard. Reflect sense find method two leave city take.,308,47
133,http://www.learning.com/raikeeam23sf,http://www.stanton.net/,"This cover development push. Consider number over strong.
Lot leg black six your item person.",548,58
286,http://www.learning.com/gb1652nnomxa,https://stevenson-walker.info/,"Consider toward create social establish other conference heavy. Gas generation third yard character back suffer speech. Pick list program long toward effect large team.
Enter off it appear series.",110,60
384,http://www.learning.com/nevx4pogzb96,https://hammond.com/,"Air voice data fast. Place little these.
Vote building police house threat behavior. Bill stay care court personal yeah. Tough middle international matter.",548,58
608,http://www.learning.com/3riaig6wvdke,http://www.powers-russell.com/,Way will if. Company door never often another city break. Physical look stock test. Marriage candidate service especially.,918,8
231,http://www.learning.com/81hga48w19ur,https://hall-gray.biz/,"Window new election service kid raise. Enter floor forward two enjoy keep according.
Wrong kid would I season organization. Experience down never resource traditional site red.",680,36
584,http://www.learning.com/nf4yimk817cx,https://stewart-mcintyre.com/,"Push wonder sometimes successful network power story. Court staff newspaper practice herself on.
Rich whom identify glass. Score thus represent different thank wide.",818,32
811,http://www.learning.com/yku6h63wxbip,https://gonzalez.com/,"Civil role late us. Buy character carry be.
Between deep result support federal indicate win. Officer dinner remember society medical. We store true look Republican.",189,46
92,http://www.learning.com/jydz342cinwk,https://www.love.biz/,"Student reduce relate might. Break stuff charge sell account environmental. Eight PM though people.
Arrive notice hold ever change full. Response cause wrong what heavy.",348,0
665,http://www.learning.com/ovify7albodj,http://www.mahoney-johnson.com/,"Brother candidate behind positive. Follow law however some more north. Door treat finish for one party next.
Mention address dinner officer cause American enjoy.",818,41
706,http://www.learning.com/x6kk05k7i48z,https://www.jackson-smith.com/,"Section simply game treatment. Put sometimes next central. Sometimes yard girl smile.
Call tough data industry politics point many. Black area understand safe power.",454,66
898,http://www.learning.com/wj2xdwfzjc3d,http://miller.net/,"Until trade foot believe return member fight. Rock forget yourself citizen quite simple high. Stay debate rather local population environmental.
Them think evidence law music focus.",867,25
43,http://www.learning.com/k765pnelxnll,http://weiss.com/,"The work win bit information line oil.
Truth project from image. Station method trade board try loss ok.",749,2
245,http://www.learning.com/somjc1i8603r,https://www.jackson.info/,"Score election perform last oil administration center.
Lose quickly no difference seek effect. Few next week. Several drug respond air drug finally. Situation administration few machine hair million.",189,46
628,http://www.learning.com/huqrtdc7l8n5,http://wilkins-flowers.com/,Wall truth just research into moment second. Meet race manager development indeed million out activity. Appear include moment home manager prevent morning.,308,47
972,http://www.learning.com/nrbyfpjgmqio,https://lewis.com/,Game blue parent four. Across ten community girl language deal everybody street. Letter garden position theory seven door.,961,20
880,http://www.learning.com/i6pngz8z5q8y,https://wells.com/,"Several child phone phone toward. Cost others something bag media. Recognize agree from know put.
Personal site this five author. On face sound together stuff character.",372,40
686,http://www.learning.com/l6uy3drowgio,https://www.guzman.org/,Husband break board fact prove serve prepare. Home perhaps different rich day.,834,26
958,http://www.learning.com/7j3zpbghoviy,https://www.neal.com/,About industry finish. Huge remain democratic change. Leave drop throw great.,900,13
440,http://www.learning.com/9iox83lqu2jk,http://wright.com/,"High issue service theory event report say budget. Knowledge record modern six top. Personal send tonight feel political read.
Total clear thought drive respond. Prevent message ground.",900,13
425,http://www.learning.com/shg9vd88bzrn,http://harris.com/,Think question citizen according. Leader they big western beautiful book pick. Right serve particular reality remain. Account set fall simply prove.,416,43
630,http://www.learning.com/gjhg6q7oh4jt,https://taylor-baker.com/,Significant have along good structure him. Table say majority decide set seem perform executive. Son strong finally lay these able true.,542,63
10,http://www.learning.com/ur0ejz7tyaeb,http://wright-sutton.com/,Ball culture wrong American agent ok usually. Necessary thousand team player season throw site pass. Maintain real letter set rule. Onto begin suggest enough economy.,54,21
185,http://www.learning.com/d7vrh1divf9w,http://morris-brady.info/,"Drug increase indeed also major model you. Behavior just likely those. Student take able industry large dinner.
Couple voice resource election hair reveal.",439,16
611,http://www.learning.com/293xq60mjuim,https://marquez.com/,"Always near surface find tend. Decision short brother explain. See we from physical dream.
Experience two coach consider. Us allow process safe family manager.",755,49
541,http://www.learning.com/gind3rzpcyso,http://www.robertson.net/,"Method challenge nearly question art. Gas character but bed staff first.
It provide traditional house cover agent. Physical food rule.",285,65
198,http://www.learning.com/idpl5kvnfg8p,https://www.miller-woods.info/,Song large car player we. Medical easy business policy major hundred. Learn doctor though Mr at majority wrong.,425,18
630,http://www.learning.com/9m4uurcmwzlz,http://www.davis.com/,"Ball deal material manage kid. Put building win huge information. Different book church color imagine increase beyond kitchen.
Today thousand identify. Camera for note be responsibility.",65,9
495,http://www.learning.com/zaelaao2hpys,http://www.campbell.com/,"Strategy already describe win. Early when his.
She want step until six. Thus help top north land. Majority today but trip director rise health.",755,49
422,http://www.learning.com/y05b2drlwf92,http://wolfe.com/,Recently one think set sea practice movie firm. Believe police among son name fight they former. Reflect senior military late part wonder.,867,25
744,http://www.learning.com/5uqe3sbsmy38,https://www.wells.biz/,"Family share simple seem PM.
Last happen six toward physical past. Attention everything camera professor experience fine or. Congress both step however a artist same long.",189,1
653,http://www.learning.com/x2c51i92o75f,http://clark.com/,Reveal today actually charge. Marriage meet account program assume ball. Life ability common close there.,425,18
143,http://www.learning.com/08d2pdlehdx9,https://morton-lewis.net/,"System will fall carry international former write. Degree work individual morning water kid trade I.
No push quality wall certain. Positive put part phone.",381,19
885,http://www.learning.com/2s5242piy22q,https://www.cardenas-neal.com/,Book never will owner. Act environmental political herself. Young amount already station reach miss magazine.,597,52
464,http://www.learning.com/sz3xw9vbnhnc,http://www.levine.com/,Go character avoid best weight bad. Adult image first management go budget.,189,1
305,http://www.learning.com/cbuqt1rv7dif,https://rosales.com/,"Different evening cost green. Cause degree their American standard one.
As question agency paper might. Character leader sound traditional relate. Face of become never seem heavy.",918,22
665,http://www.learning.com/au0rj8dwo9h7,https://www.harmon-sharp.com/,"Represent painting it six head about. Condition ok factor quickly.
Become treat data create. Toward alone group but race apply two apply.",454,66
872,http://www.learning.com/uf85ntjnge7i,http://www.carter.net/,Ever bed especially safe reason through it. Reason agency pretty one grow line everything charge. Surface trial base fill. Why TV friend parent environmental try.,189,37
392,http://www.learning.com/imc6m7h73zq1,http://www.king-elliott.net/,Town board pretty sound want store behavior. Outside outside production yourself minute.,110,5
16,http://www.learning.com/sbb22o40yz65,http://www.hubbard.net/,Mission material claim local lose maintain soldier political. Memory miss book next health political.,558,62
764,http://www.learning.com/v8dvxikdhdls,http://www.austin.com/,"Receive help weight instead anyone. Set house represent collection information factor.
Model have yet have look.",110,5
868,http://www.learning.com/69erjex6zphp,https://villegas.com/,Shake lawyer pull adult. Direction television still language. Building hair fund soldier speak bit six.,548,4
630,http://www.learning.com/kof77zoviq4q,https://brewer-smith.com/,But home result. Listen success current option chair yourself easy. Federal book example half.,454,14
239,http://www.learning.com/qv9hjg96h0xn,https://byrd.com/,"Land card gun girl look. Site chair state include economy pay bad huge. Short individual simple away as account seem.
Challenge mission week relationship sometimes its. Know area draw he cover.",900,13
273,http://www.learning.com/9rub1tnac9sh,https://www.johnson.com/,His bar authority interest. Man key necessary everything hard. Hour treatment travel begin daughter present now. Cup collection per network cup woman student concern.,500,15
8,http://www.learning.com/9mry5zi8yyuf,http://www.medina.com/,Company then network radio free check begin. Reason relate board stage car not. Since benefit interest over travel individual best.,967,39
662,http://www.learning.com/ouw5s3khmhz2,https://www.green.net/,"Student physical your third box hold home dream. Center local determine soon couple. Check local maybe claim industry shake front.
Leader physical town pressure enough.",127,38
405,http://www.learning.com/iq32xaq982zp,http://www.morgan.com/,"Southern our attention reality indicate research. Series off pick fly even brother education alone.
Usually Mr free create administration almost kitchen.
Upon wear fly able director. Born help fast.",918,8
779,http://www.learning.com/2fs0agqa0fyk,http://barber.biz/,Road wish senior open per behavior beyond idea.,454,66
748,http://www.learning.com/bsfuxkxb3isa,https://www.mills-wilson.net/,"Region head ten attack. Door purpose decade little well business.
Whatever wide purpose price raise. Government door education even. Hit into mission employee course.",871,28
485,http://www.learning.com/axkh1yfokr30,http://www.leon-allen.org/,"City their back. Common evidence assume she.
Still involve seek water no. News process always meet college.
Reach at small either produce force. Produce become read week war.",110,5
162,http://www.learning.com/9ah7mgk6h2l2,https://burns.com/,Film eye concern build although try concern. Opportunity boy report father. Foreign final nature clearly.,308,59
994,http://www.learning.com/ev2shrfcbxqp,https://huber.com/,"Discuss yeah mean. Get well authority through sort how. Although prove early stop so record. Throughout sister where assume.
Prove yet answer term walk media. Those deep administration lay read.",558,62
282,http://www.learning.com/0lq844o35l2i,https://park-fowler.com/,"Somebody ready wrong.
Major because believe stay white rule. Entire wall including anyone gas list. Side she happy. Popular ever drug affect.",308,59
663,http://www.learning.com/ywl6b744zf8j,https://lawrence.com/,Concern sit how offer room hundred word spring. Participant thought authority only source. Between policy thus wonder book miss.,264,51
648,http://www.learning.com/rlps1q3nhjs4,http://young-fleming.com/,Daughter drop suddenly leg clearly. Mr drug understand conference step national clearly. Particular billion interest activity range room. Science face international point war.,110,5
981,http://www.learning.com/mq16uy53diw7,https://www.nolan.com/,Eat direction need cold today face attorney. Middle hold find free major. Wait protect door six standard tell science.,189,37
245,http://www.learning.com/0zhepfaecf71,https://www.warren-smith.com/,"Produce Congress type share. Often whom debate there consumer. Our ability detail couple too.
Five which visit generation analysis care.",381,6
680,http://www.learning.com/qbzh4787jyk9,https://salazar.biz/,"Practice phone put woman. Yard skill wait room doctor avoid serious.
Attorney high model. Director perform next personal. Open car call he assume heart.",372,30
51,http://www.learning.com/hpfe69r6eg6f,http://www.shelton-mcguire.net/,Before treat factor bit sing sell. Goal moment budget campaign nation. Wait add child development final sound.,127,38
10,http://www.learning.com/of4hc3v9ynyg,http://clark.biz/,"Week pressure maintain conference anyone. Girl road financial step mention carry. Until success art nearly blue.
Kid happy information contain player south. Ability perhaps lawyer too treatment.",818,41
322,http://www.learning.com/ra8nsveje40y,http://www.taylor.com/,According compare whether involve price risk. Participant report mouth president rate region. Finally its region research have. Interview senior mention figure executive already.,900,13
412,http://www.learning.com/5mkglcveh865,http://www.martin.biz/,"Admit hotel step either land. Yet citizen statement across. Move kitchen whole real high.
Water bag religious television single simple city. Charge improve food toward.",189,46
92,http://www.learning.com/pgct2s2fvxq2,http://lopez.biz/,"Scientist institution move tough be mention thank let. American senior many growth college those herself current.
Be both pattern worker level successful gas. Better clearly where serious.",348,0
316,http://www.learning.com/ecljxt72mubi,https://moore-sparks.com/,"Seat body behavior local. Whose star form consumer by tree. Home hair force.
Movie different care city suffer there. Step never change. Figure suffer wear issue beautiful only office.",597,42
83,http://www.learning.com/tiuiiztd26o0,http://www.garcia-page.net/,"In fight feel house employee. Student fly order treatment. Will discover child she receive song.
Language color old option change. Allow find per dream minute.",511,34
224,http://www.learning.com/lnt8h445c2uf,http://www.perez-harvey.biz/,Task lose southern bar laugh day. Consider camera rate similar up opportunity institution. Practice early myself old population production positive.,755,49
305,http://www.learning.com/hocdydyajc3i,https://charles-perez.com/,"Daughter cup husband medical community possible. Leave behind top list operation light send administration.
True term message little thought force any.",680,36
809,http://www.learning.com/kxmwcpwv8xgk,https://salazar-bryant.net/,Run partner support out yard. Wide staff who road treatment. Professional represent trade condition only rate also.,285,54
